{
  "message_id": "msg-cmd-fw-001",
  "transaction_id": "txn-fw-001",
  "action": "update_firmware",
  "timestamp": "2026-10-22T09:00:00Z",
  "data": {
    "version": "0.2.0",
    "url": "https://open-locker.cloud/api/firmware/0b6f5a52-0f2d-4c58-9a57-3f1e7f1c2a11/7d1c9e34-8a47-4b1e-b0a2-5c3d9e6f1a22?expires=1792659600&signature=0000000000000000000000000000000000000000000000000000000000000000",
    "allow_downgrade": false
  }
}
