{
  "message_id": "msg-cmd-config-001",
  "transaction_id": "txn-config-001",
  "action": "apply_config",
  "timestamp": "2026-04-14T19:31:00Z",
  "data": {
    "config_hash": "3306f9a74f407226b567536b577fa7dfd460a674850ce9d1818aabe94f55ab62",
    "heartbeat_interval_seconds": 15,
    "adapter_type": "rs485_lock_board",
    "feedback_type": "door_closing",
    "compartments": [
      {
        "compartment_number": 1,
        "slaveId": 1,
        "address": 0
      },
      {
        "compartment_number": 2,
        "slaveId": 1,
        "address": 1
      }
    ]
  }
}
